{
  "schema_version": "2.0",
  "country": "United Kingdom (Devolved: Scotland / Northern Ireland / Wales)",
  "country_code": "UK-DEV",
  "type": "lawyers",
  "license": "CC-BY-4.0",
  "generated": "2026-05-31",
  "jurisdictional_context": "Scotland operates a wholly separate child-law statutory and judicial architecture from England and Wales. The governing primary legislation is the Children (Scotland) Act 1995, with section 11 (court orders relating to parental responsibilities) and the post-2020 section 11(7C) factors (effect of relevant abuse, co-operation between parents, risk of further abuse) framing the test the Court of Session and the sheriff courts apply in private-ordering disputes. The strongest Scottish judicial PA finding to date is Lord Stuart's NF v AF [2025] CSOH 13 (Outer House), in which the senator found that the defender 'engaged in direct emotional abuse by knowingly making false and severe allegations against the Pursuer, aiming to alienate the children from him' — currently the clearest expressly-PA Scottish judgment (cross-link case-study:nf-v-af-2025-csoh-13-scotland). The practising bar is bifurcated between the Faculty of Advocates (advocates' professional body, including KCs and senators) and the Law Society of Scotland (solicitor regulator and accreditor of family-law and child-law specialists). The PA conversation in Scotland is dominated institutionally by Shared Parenting Scotland (SCIO SC042817, the recognition-camp lobby, formerly Families Need Fathers Scotland) at one pole and by Scottish Women's Aid plus Engender (the feminist/critique-camp coalition) at the other; the recognition pole in Scotland is institutional rather than bar-based.\n\nNorthern Ireland's child-law architecture is the Children (Northern Ireland) Order 1995 (a Sewel-style Order in Council mirroring Children Act 1989 but distinct), litigated in the High Court of Justice and Court of Judicature of Northern Ireland. The Lady Chief Justice — Rt Hon Dame Siobhan Keegan DBE KC (sworn 2 September 2021), the first woman Lady Chief Justice in NI history — was previously a family-law silk and Senior Family Judge of the High Court NI (2020-2021), giving NI's family judiciary unusual structural sophistication on child-welfare issues. The clearest current NI judicial engagement with an alienating-style dynamic — without the explicit PA label — is Mr Justice O'Hara's August 2022 judgment in A Father v A Mother (in the matter of NI, a male child aged 10) (No. 2), where he found one parent's 'core belief that he had been wronged' was incompatible with facilitating contact while declining to transfer residence. Institutionally the critique pole is occupied by Women's Aid Federation Northern Ireland (WAFNI), whose 25 June 2020 PA briefing remains the only NI-specific WA published institutional position. The Bar of Northern Ireland's Family Bar Association functions as the institutional gateway to the practising NI family bar.\n\nWales' family-court infrastructure operates within the unified Bar of England and Wales but is administered locally via Cafcass Cymru (the Children and Family Court Advisory and Support Service for Wales, devolved to the Welsh Government), which produces its own welfare-reporting framework distinct from English Cafcass. The Welsh-jurisdiction PA debate is academically anchored almost entirely on Dr Julie Doughty (Cardiff University School of Law and Politics), whose Welsh-Government-commissioned 2018 literature review Review of Research and Case Law on Parental Alienation (Doughty, Maxwell & Slater, April 2018) is the source document on which Cafcass Cymru policy on PA derives — and the canonical Welsh academic anchor framing PA as a 'belief system' rather than empirically grounded clinical concept. The Welsh family bar is dominated by public-law children practice (30 Park Place; 9 Park Place; Queen Square Chambers), with Welsh-language capacity concentrated at Linenhall Chambers (institutional Welsh-medium placeholder; no individual Welsh-medium PA-experienced barrister verified by sourced stance). Welsh Women's Aid carries the federation-aligned critique-camp position for Welsh-language outreach.",
  "structural_findings": [
    "20 verified entries split 9 SCO + 5 NIR + 6 WLS, reflecting the disproportionate institutional and academic infrastructure in Wales (Cafcass Cymru / Cardiff Law) and the comparatively thin verifiable NI practitioner footprint outside the judiciary.",
    "The verifiable practising-bar PA conversation in the devolved jurisdictions is dominated by institutional voices (Shared Parenting Scotland recognition pole; SWA / Engender / WAFNI / WWA critique pole) and judicial output (Lord Stuart's NF v AF [2025] CSOH 13 in Scotland; O'Hara J's 2022 A Father v A Mother (No. 2) in NI) more than by named individual practitioners with published stances.",
    "Scotland's recognition pole is institutional (Shared Parenting Scotland, SCIO SC042817) rather than bar-based: no Faculty of Advocates KC has been identified with an explicit, sourced recognition-camp PA stance on a chambers or Faculty profile.",
    "Northern Ireland has only one named academic in the PA-specific field (Dr Mairead McCormack, QUB, DChild 2021) — the only NI-specific empirical study of how PA is treated by NI family-court professionals; the NI bar's PA footprint is otherwise judicial (Keegan LCJ, O'Hara J) and institutional (WAFNI, Bar of NI Family Bar Association).",
    "The Welsh family bar is dominated by public-law children practice; Joseff Morgan (9 Park Place) is the only named Welsh-jurisdiction junior with an explicit recognition-camp PA stance on a chambers website (Re E chambers profile: 'secured substantial and numerous findings against a parent in relation to emotional harm of the child, and parental alienation of the separated parent').",
    "NF v AF [2025] CSOH 13 (Lord Stuart) is cross-linked from all Scottish bar entries (Faculty advocates, Court of Session judiciary, and Law Society accredited specialists) as the structural PA anchor in Scots law; McFarlane P's Re Y is cross-linked from devolved-jurisdiction entries as the cross-border critique-axis comparator on disproportionate PA findings.",
    "Four major v1.0 corrections preserved in excluded[]: Mary Connolly KC (NI) does not exist (Bar of NI directory returns Martina Connolly KC); Jonathan Dunlop KC (NI) is commercial / professional negligence / judicial review, not family-law silk (KC status itself not publicly confirmed); Cara Goodwin Advocate (Scotland) not on Faculty of Advocates register; Family Law Scotland Ltd (institutional) not located on Companies House or Law Society of Scotland register.",
    "Geographic diversity findings: Scotland coverage extends beyond the Edinburgh/Glasgow axis (Sandra Sutherland, Thorntons Law, Dundee/Tayside; Sarah Lilley, Brodies, Inverness/Highlands); Welsh coverage anchors on Cardiff (Doughty, John, Morgan, Halliday) with Welsh-medium capacity at Linenhall Chambers; NI coverage anchors on Belfast bar and judiciary.",
    "Stance distribution including institutional entries: 4 recognition (Lord Stuart, Joseff Morgan, Shared Parenting Scotland, plus recognition-leaning O'Hara without label); 8 critique (SWA, Engender, WAFNI, Welsh Women's Aid, McCormack academic critique-camp, Doughty academic critique-camp framing PA as belief-system, plus federation-aligned satellites); remainder middle / institutional / judicial-middle — the devolved-jurisdiction critique camp is institutionally over-represented relative to England & Wales."
  ],
  "entries": [
    {
      "id": "uk-sco.scott-kc",
      "name": "Janys M Scott KC, Advocate",
      "credentials": "KC (Faculty of Advocates, Year of Call 1992, Year of Silk 2007); previously admitted solicitor (England and Scotland); part-time sheriff since 2005; Accredited Family Law Arbitrator (FLAGS)",
      "city": "Edinburgh",
      "region": "Scotland",
      "affiliation": "Westwater Advocates (Edinburgh); Faculty of Advocates; CCBE Family & Succession Committee (UK representative); former Chair, Advocates' Family Law Association 2013-2018",
      "stance": "middle",
      "stance_notes": "Most senior Scottish family-law silk; star-ranked Chambers UK Bar 2026 family (children & matrimonial finance). Senior counsel in seven Supreme Court cases. Specific named PA judgments as lead counsel not publicly confirmed; children-law specialism is institutional. Author, Education Law in Scotland (2nd ed., 2016). Scottishlegal.com 'Lawyer of the Month' interview is the public-source basis for the middle / institutional positioning.",
      "publications": [
        {"title": "Education Law in Scotland (2nd ed.)", "year": 2016, "venue": "W. Green / Thomson Reuters"}
      ],
      "urls": [
        "https://www.westwateradvocates.com/counsel/janys-m-scott-kc/",
        "https://www.advocates.org.uk/advocates/janys-margaret-scott",
        "https://www.scottishlegal.com/articles/lawyer-of-the-month-janys-scott-qc"
      ],
      "contact": "janys.scott@westwateradvocates.com ; 0131 226 5071",
      "verification_notes": "Faculty of Advocates roll and Westwater Advocates profile both verify silk status and family-law specialism; no named PA judgment as lead counsel verifiable via Scottish Courts publication search.",
      "references": [
        "jurisdiction:scotland",
        "jurisdiction:uk-devolved",
        "case-study:nf-v-af-2025-csoh-13-scotland",
        "practitioner:uk-sco.lord-stuart"
      ]
    },
    {
      "id": "uk-sco.lord-stuart",
      "name": "Lord Stuart (The Hon Lord Stuart), Senator of the College of Justice",
      "credentials": "Senator of the College of Justice (May 2022); KC (2017); Advocate Depute 2009-2012; called Scottish Bar July 2003",
      "city": "Edinburgh",
      "region": "Scotland",
      "affiliation": "Outer House, Court of Session — designated Family Judge (since November 2022)",
      "stance": "recognition",